{
  "version": "7.0.0",
  "line_id": "LINE-A3",
  "password": "1111",

  "pin_count_min": 40,
  "pin_count_max": 40,
  "pin_rows": {
    "top": 20,
    "bottom": 20
  },

  "vision": {
    "model_path": "assets/models/yolo26x_local_pretrained.pt",
    "confidence_threshold": 0.60,
    "pin_area_min_px": 8,
    "scan_region": null
  },

  "control": {
    "retries": 3,
    "move_duration": 0.30,
    "click_pause": 0.50,
    "drag_duration": 0.40,
    "retry_delay": 0.50,
    "step_delay": 1.00
  },

  "llm": {
    "enabled": true,
    "backend": "ollama",
    "model_path": "gemma4:9b",
    "http_url": "http://localhost:11434/api/chat",
    "ctx_size": 8192,
    "gpu_layers": 0,
    "max_input_tokens": 6144,
    "max_output_tokens": 1024,
    "turboquant_enabled": true,
    "turboquant_mode": "--turboquant",
    "allow_config_write": false,
    "sop_generation": {
      "model_path": "qwen3:8b",
      "ctx_size": 32768,
      "max_output_tokens": 4096,
      "temperature": 0.1
    }
  },

  "ocr": {
    "enabled": true,
    "backend": "auto",
    "threshold": 0.80,
    "fuzzy_match": true,
    "popup_keywords": [
      "Windows Update",
      "Restart now",
      "Remind me later",
      "Activate Windows",
      "Run anyway",
      "More info",
      "User Account Control",
      "Windows protected your PC"
    ]
  },

  "audit": {
    "enabled": true,
    "log_path": "logs/config_audit.jsonl",
    "require_username": true
  }
}
