{
  "version": "2.2.0",
  "line_id": "LINE-A3",
  "password": "1111",
  "pin_count_min": 40,
  "pin_count_max": 40,
  "pin_rows": {
    "top": 20,
    "bottom": 20
  },
  "vision": {
    "model_path": "assets/models/yolo26x.pt",
    "confidence_threshold": 0.6,
    "pin_area_min_px": 8,
    "scan_region": null
  },
  "control": {
    "retries": 3,
    "move_duration": 0.3,
    "click_pause": 0.5,
    "drag_duration": 0.4,
    "retry_delay": 0.5,
    "step_delay": 1.0
  },
  "llm": {
    "enabled": true,
    "backend": "ollama",
    "model_path": "pedrolucas/smollm3:3b-q4_k_m",
    "http_url": "http://localhost:11434/v1/chat/completions",
    "ctx_size": 8192,
    "max_input_tokens": 6144,
    "max_output_tokens": 1024,
    "allow_config_write": false
  },
  "ocr": {
    "enabled": true,
    "backend": "auto",
    "threshold": 0.8,
    "fuzzy_match": true,
    "popup_keywords": [
      "Windows Update",
      "Restart now",
      "Remind me later",
      "Activate Windows",
      "Run anyway",
      "More info",
      "User Account Control",
      "Windows protected your PC"
    ]
  },
  "audit": {
    "enabled": true,
    "log_path": "logs/config_audit.jsonl",
    "require_username": true
  }
}